{
  "schema_version": 1,
  "synthetic_test_only": true,
  "scope": {
    "source_sha": "b7d45d3cc1a1c80f17fe0cebccbdc397439b81fd",
    "primary_artifact_sha256": "aaaaaaaaaaaaaaaaaaaaaaaaaaaaaaaaaaaaaaaaaaaaaaaaaaaaaaaaaaaaaaaa",
    "negative_artifact_sha256": "bbbbbbbbbbbbbbbbbbbbbbbbbbbbbbbbbbbbbbbbbbbbbbbbbbbbbbbbbbbbbbbb",
    "platform": "windows-x86_64",
    "negative_platform": "linux-x86_64",
    "os_build": "10.0.26100.1",
    "features": ["windows-broker", "native-read"],
    "backend": "experimental_direct_wam",
    "cloud": "public",
    "tenant_id": "11111111-2222-3333-4444-555555555555",
    "negative_tenant_id": "22222222-2222-3333-4444-555555555555",
    "guest_home_tenant_id": "33333333-2222-3333-4444-555555555555",
    "client_id": "44444444-2222-3333-4444-555555555555",
    "account_ref": "synthetic-selected-account",
    "negative_account_ref": "synthetic-other-account",
    "guest_account_ref": "synthetic-guest-account",
    "principal_ref": "synthetic-selected-principal",
    "workspace_ids": ["55555555-2222-3333-4444-555555555555"],
    "resource_ids": ["66666666-2222-3333-4444-555555555555"],
    "arm_subscription_id": "77777777-2222-3333-4444-555555555555",
    "fabric_host": "api.fabric.microsoft.com",
    "onelake_host": "onelake.dfs.fabric.microsoft.com",
    "arm_host": "management.azure.com",
    "audiences": ["https://api.fabric.microsoft.com/.default", "https://storage.azure.com/.default", "https://management.azure.com/.default"],
    "allowed_actions": ["broker_login", "broker_silent_refresh", "broker_signout", "service_read"],
    "allowed_mutations": ["broker_cache_update", "broker_app_signout"],
    "service_mutations": [],
    "cleanup_plan_ref": "synthetic-cleanup-plan",
    "recovery_plan_ref": "synthetic-recovery-plan",
    "cleanup_owner_ref": "synthetic-cleanup-owner"
  },
  "authorization": {
    "status": "approved",
    "scope_sha256": "1dcb35e91567194c9d349785702a727ab214dfe8f72c3439e7928f54dcc7ef0d",
    "approval_ref": "synthetic-scope-approval",
    "approver_ref": "synthetic-environment-owner",
    "registration_review_ref": "synthetic-registration-review",
    "approved_at": "2026-10-28T08:00:00Z",
    "expires_at": "2026-10-28T20:00:00Z"
  },
  "evidence": [
    {
      "id": "synthetic-broker-receipt",
      "sha256": "cccccccccccccccccccccccccccccccccccccccccccccccccccccccccccccccc",
      "source_sha": "b7d45d3cc1a1c80f17fe0cebccbdc397439b81fd",
      "artifact_sha256": "aaaaaaaaaaaaaaaaaaaaaaaaaaaaaaaaaaaaaaaaaaaaaaaaaaaaaaaaaaaaaaaa",
      "scope_sha256": "1dcb35e91567194c9d349785702a727ab214dfe8f72c3439e7928f54dcc7ef0d",
      "kind": "native_broker",
      "recorded_at": "2026-10-28T12:01:00Z",
      "case_ids": ["selection_missing", "account_mismatch", "tenant_mismatch", "account_ambiguous", "guest_tenant", "audience_sequence", "partial_acquisition", "mfa", "conditional_access", "expiry_metadata", "silent_refresh", "silent_interaction_required", "cancel_lifecycle", "signout_recovery", "signout_refresh_race", "provider_absent", "secret_safe_outputs", "teardown_recovery"]
    },
    {
      "id": "synthetic-service-receipt",
      "sha256": "dddddddddddddddddddddddddddddddddddddddddddddddddddddddddddddddd",
      "source_sha": "b7d45d3cc1a1c80f17fe0cebccbdc397439b81fd",
      "artifact_sha256": "aaaaaaaaaaaaaaaaaaaaaaaaaaaaaaaaaaaaaaaaaaaaaaaaaaaaaaaaaaaaaaaa",
      "scope_sha256": "1dcb35e91567194c9d349785702a727ab214dfe8f72c3439e7928f54dcc7ef0d",
      "kind": "native_service",
      "recorded_at": "2026-10-28T12:01:00Z",
      "case_ids": ["fabric_read", "onelake_read", "arm_read"]
    },
    {
      "id": "synthetic-clean-machine-receipt",
      "sha256": "eeeeeeeeeeeeeeeeeeeeeeeeeeeeeeeeeeeeeeeeeeeeeeeeeeeeeeeeeeeeeeee",
      "source_sha": "b7d45d3cc1a1c80f17fe0cebccbdc397439b81fd",
      "artifact_sha256": "aaaaaaaaaaaaaaaaaaaaaaaaaaaaaaaaaaaaaaaaaaaaaaaaaaaaaaaaaaaaaaaa",
      "scope_sha256": "1dcb35e91567194c9d349785702a727ab214dfe8f72c3439e7928f54dcc7ef0d",
      "kind": "native_clean_machine",
      "recorded_at": "2026-10-28T12:01:00Z",
      "case_ids": ["no_developer_tools", "no_raw_token_fallback"]
    },
    {
      "id": "synthetic-platform-receipt",
      "sha256": "ffffffffffffffffffffffffffffffffffffffffffffffffffffffffffffffff",
      "source_sha": "b7d45d3cc1a1c80f17fe0cebccbdc397439b81fd",
      "artifact_sha256": "bbbbbbbbbbbbbbbbbbbbbbbbbbbbbbbbbbbbbbbbbbbbbbbbbbbbbbbbbbbbbbbb",
      "scope_sha256": "1dcb35e91567194c9d349785702a727ab214dfe8f72c3439e7928f54dcc7ef0d",
      "kind": "native_platform_negative",
      "recorded_at": "2026-10-28T12:01:00Z",
      "case_ids": ["platform_absent"]
    }
  ],
  "cases": [
    {"id": "selection_missing", "status": "executed_pass", "observation": "expected_observed", "executed_at": "2026-10-28T12:00:00Z", "evidence_ids": ["synthetic-broker-receipt"]},
    {"id": "account_mismatch", "status": "executed_pass", "observation": "expected_observed", "executed_at": "2026-10-28T12:00:00Z", "evidence_ids": ["synthetic-broker-receipt"]},
    {"id": "tenant_mismatch", "status": "executed_pass", "observation": "expected_observed", "executed_at": "2026-10-28T12:00:00Z", "evidence_ids": ["synthetic-broker-receipt"]},
    {"id": "account_ambiguous", "status": "executed_pass", "observation": "expected_observed", "executed_at": "2026-10-28T12:00:00Z", "evidence_ids": ["synthetic-broker-receipt"]},
    {"id": "guest_tenant", "status": "executed_pass", "observation": "expected_observed", "executed_at": "2026-10-28T12:00:00Z", "evidence_ids": ["synthetic-broker-receipt"]},
    {"id": "audience_sequence", "status": "executed_pass", "observation": "expected_observed", "executed_at": "2026-10-28T12:00:00Z", "evidence_ids": ["synthetic-broker-receipt"]},
    {"id": "partial_acquisition", "status": "executed_pass", "observation": "expected_observed", "executed_at": "2026-10-28T12:00:00Z", "evidence_ids": ["synthetic-broker-receipt"]},
    {"id": "mfa", "status": "executed_pass", "observation": "expected_observed", "executed_at": "2026-10-28T12:00:00Z", "evidence_ids": ["synthetic-broker-receipt"]},
    {"id": "conditional_access", "status": "executed_pass", "observation": "expected_observed", "executed_at": "2026-10-28T12:00:00Z", "evidence_ids": ["synthetic-broker-receipt"]},
    {"id": "expiry_metadata", "status": "executed_pass", "observation": "expected_observed", "executed_at": "2026-10-28T12:00:00Z", "evidence_ids": ["synthetic-broker-receipt"]},
    {"id": "silent_refresh", "status": "executed_pass", "observation": "expected_observed", "executed_at": "2026-10-28T12:00:00Z", "evidence_ids": ["synthetic-broker-receipt"]},
    {"id": "silent_interaction_required", "status": "executed_pass", "observation": "expected_observed", "executed_at": "2026-10-28T12:00:00Z", "evidence_ids": ["synthetic-broker-receipt"]},
    {"id": "cancel_lifecycle", "status": "executed_pass", "observation": "expected_observed", "executed_at": "2026-10-28T12:00:00Z", "evidence_ids": ["synthetic-broker-receipt"]},
    {"id": "signout_recovery", "status": "executed_pass", "observation": "expected_observed", "executed_at": "2026-10-28T12:00:00Z", "evidence_ids": ["synthetic-broker-receipt"]},
    {"id": "signout_refresh_race", "status": "executed_pass", "observation": "expected_observed", "executed_at": "2026-10-28T12:00:00Z", "evidence_ids": ["synthetic-broker-receipt"]},
    {"id": "provider_absent", "status": "executed_pass", "observation": "expected_observed", "executed_at": "2026-10-28T12:00:00Z", "evidence_ids": ["synthetic-broker-receipt"]},
    {"id": "no_developer_tools", "status": "executed_pass", "observation": "expected_observed", "executed_at": "2026-10-28T12:00:00Z", "evidence_ids": ["synthetic-clean-machine-receipt"]},
    {"id": "no_raw_token_fallback", "status": "executed_pass", "observation": "expected_observed", "executed_at": "2026-10-28T12:00:00Z", "evidence_ids": ["synthetic-clean-machine-receipt"]},
    {"id": "platform_absent", "status": "executed_pass", "observation": "expected_observed", "executed_at": "2026-10-28T12:00:00Z", "evidence_ids": ["synthetic-platform-receipt"]},
    {"id": "fabric_read", "status": "executed_pass", "observation": "expected_observed", "executed_at": "2026-10-28T12:00:00Z", "evidence_ids": ["synthetic-service-receipt"]},
    {"id": "onelake_read", "status": "executed_pass", "observation": "expected_observed", "executed_at": "2026-10-28T12:00:00Z", "evidence_ids": ["synthetic-service-receipt"]},
    {"id": "arm_read", "status": "executed_pass", "observation": "expected_observed", "executed_at": "2026-10-28T12:00:00Z", "evidence_ids": ["synthetic-service-receipt"]},
    {"id": "secret_safe_outputs", "status": "executed_pass", "observation": "expected_observed", "executed_at": "2026-10-28T12:00:00Z", "evidence_ids": ["synthetic-broker-receipt"]},
    {"id": "teardown_recovery", "status": "executed_pass", "observation": "expected_observed", "executed_at": "2026-10-28T12:00:00Z", "evidence_ids": ["synthetic-broker-receipt"]}
  ],
  "signoffs": [
    {"role": "release_owner", "owner_ref": "synthetic-release-owner", "approval_ref": "synthetic-release-review", "status": "approved", "scope_sha256": "1dcb35e91567194c9d349785702a727ab214dfe8f72c3439e7928f54dcc7ef0d", "packet_sha256": "7aa083bb544e1a2cf5542c27cfee9a94def401d962d754e72bfc7669c79d223d", "signed_at": "2026-10-28T13:00:00Z"},
    {"role": "identity_support_owner", "owner_ref": "synthetic-identity-owner", "approval_ref": "synthetic-support-review", "status": "approved", "scope_sha256": "1dcb35e91567194c9d349785702a727ab214dfe8f72c3439e7928f54dcc7ef0d", "packet_sha256": "7aa083bb544e1a2cf5542c27cfee9a94def401d962d754e72bfc7669c79d223d", "signed_at": "2026-10-28T13:00:00Z"},